{
  "contract_version": "0.1.0",
  "evaluation_id": "EVAL-DEMO-CB-001",
  "request_id": "REQ-DEMO-CB-001",
  "ruleset_version": "0.1.0",
  "ruleset_hash": null,
  "status": "COMPLETED",
  "started_at": "2026-09-26T08:30:01+02:00",
  "finished_at": "2026-09-26T08:30:01+02:00",
  "steps_executed": 5,
  "outcome": {
    "type": "TREATMENT_SCHEME",
    "scheme_id": "CB_S1_R1"
  },
  "missing_facts": [],
  "trace": [
    {
      "sequence": 1,
      "node_id": "CB-N001",
      "node_type": "BOOLEAN_DECISION",
      "status": "EVALUATED",
      "inputs": {
        "SPUTUM_PURULENCE_INCREASE": true
      },
      "edge_evaluations": [
        {
          "edge_id": "CB-E001",
          "result": "TRUE",
          "selected": true
        },
        {
          "edge_id": "CB-E002",
          "result": "FALSE",
          "selected": false
        }
      ],
      "selected_edge_id": "CB-E001",
      "next_node_id": "CB-N002",
      "score_details": null
    },
    {
      "sequence": 2,
      "node_id": "CB-N002",
      "node_type": "SCORE_DECISION",
      "status": "EVALUATED",
      "inputs": {},
      "edge_evaluations": [
        {
          "edge_id": "CB-E003",
          "result": "TRUE",
          "selected": true
        },
        {
          "edge_id": "CB-E004",
          "result": "FALSE",
          "selected": false
        }
      ],
      "selected_edge_id": "CB-E003",
      "next_node_id": "CB-N003",
      "score_details": {
        "score_group_id": "CB_MAJOR2",
        "total": 1
      }
    },
    {
      "sequence": 3,
      "node_id": "CB-N003",
      "node_type": "SCORE_DECISION",
      "status": "EVALUATED",
      "inputs": {},
      "edge_evaluations": [
        {
          "edge_id": "CB-E005",
          "result": "TRUE",
          "selected": true
        },
        {
          "edge_id": "CB-E006",
          "result": "FALSE",
          "selected": false
        }
      ],
      "selected_edge_id": "CB-E005",
      "next_node_id": "CB-S1-N001",
      "score_details": {
        "score_group_id": "CB_RISK6_SOURCE",
        "total": 0
      }
    },
    {
      "sequence": 4,
      "node_id": "CB-S1-N001",
      "node_type": "BOOLEAN_DECISION",
      "status": "EVALUATED",
      "inputs": {
        "BETA_LACTAM_INTOLERANCE": false
      },
      "edge_evaluations": [
        {
          "edge_id": "CB-S1-E001",
          "result": "TRUE",
          "selected": true
        },
        {
          "edge_id": "CB-S1-E002",
          "result": "FALSE",
          "selected": false
        }
      ],
      "selected_edge_id": "CB-S1-E001",
      "next_node_id": "CB-S1-N002",
      "score_details": null
    },
    {
      "sequence": 5,
      "node_id": "CB-S1-N002",
      "node_type": "SCORE_DECISION",
      "status": "EVALUATED",
      "inputs": {},
      "edge_evaluations": [
        {
          "edge_id": "CB-S1-E003",
          "result": "TRUE",
          "selected": true
        },
        {
          "edge_id": "CB-S1-E004",
          "result": "FALSE",
          "selected": false
        }
      ],
      "selected_edge_id": "CB-S1-E003",
      "next_node_id": "CB-S1-T1",
      "score_details": {
        "score_group_id": "SAFETY7",
        "total": 0
      }
    }
  ],
  "errors": [],
  "engine_metadata": {
    "engine_version": "0.1.0",
    "duration_ms": 3
  }
}